{
  "$schema": "https://json-schema.org/draft/2020-12/schema",
  "$id": "https://schemas.sistematech.local/esocial/v1/esocial-s-1207-sgp-request-dto-v1.schema.json",
  "title": "eSocial S-1207 SGP request DTO v1",
  "type": "object",
  "additionalProperties": false,
  "properties": {
    "eventClass": {
      "const": "S-1207"
    },
    "tenantId": {
      "type": "string",
      "minLength": 1
    },
    "sourceEventId": {
      "type": "string",
      "minLength": 1
    },
    "sourceEntityId": {
      "type": "string",
      "minLength": 1
    },
    "sourceEntityIds": {
      "type": "array",
      "items": {
        "type": "string",
        "minLength": 1
      }
    },
    "environment": {
      "enum": [
        "qualification",
        "restricted_production",
        "production"
      ]
    },
    "operation": {
      "enum": [
        "inclusion",
        "change",
        "rectification",
        "exclusion"
      ]
    },
    "employerCnpj": {
      "type": "string",
      "minLength": 1
    },
    "competence": {
      "type": "string",
      "minLength": 1
    },
    "payrollRunId": {
      "type": "string",
      "minLength": 1
    },
    "payrollRunStatus": {
      "type": "string",
      "minLength": 1
    },
    "benefits": {
      "type": "array",
      "minItems": 1,
      "items": {
        "type": "object",
        "additionalProperties": false,
        "properties": {
          "employeeId": {
            "type": "string",
            "minLength": 1
          },
          "beneficiaryCpf": {
            "type": "string",
            "minLength": 1
          },
          "benefitSourceKind": {
            "enum": [
              "RETIREMENT",
              "PENSION"
            ]
          },
          "benefitSourceId": {
            "type": "string",
            "minLength": 1
          },
          "benefitNumber": {
            "type": "string",
            "minLength": 1
          },
          "activeBenefitCount": {
            "type": "integer",
            "minimum": 0
          },
          "establishmentRegistrationNumber": {
            "type": "string",
            "minLength": 1
          },
          "ideDmDev": {
            "type": "string",
            "minLength": 1
          },
          "eventId": {
            "type": "string",
            "minLength": 1
          },
          "rubrics": {
            "type": "array",
            "minItems": 1,
            "items": {
              "type": "object",
              "additionalProperties": false,
              "properties": {
                "rubricCode": {
                  "type": "string",
                  "minLength": 1
                },
                "rubricTableId": {
                  "type": "string",
                  "minLength": 1
                },
                "amount": {
                  "anyOf": [
                    {
                      "type": "string",
                      "minLength": 1
                    },
                    {
                      "type": "number"
                    }
                  ]
                },
                "quantity": {
                  "anyOf": [
                    {
                      "type": "string",
                      "minLength": 1
                    },
                    {
                      "type": "number"
                    }
                  ]
                },
                "kind": {
                  "enum": [
                    "EARNING",
                    "DEDUCTION",
                    "INFORMATION",
                    "BASE"
                  ]
                }
              },
              "required": [
                "rubricCode",
                "amount",
                "kind"
              ]
            }
          }
        },
        "required": [
          "employeeId",
          "beneficiaryCpf",
          "benefitSourceKind",
          "benefitSourceId",
          "benefitNumber",
          "activeBenefitCount",
          "rubrics"
        ]
      }
    }
  },
  "required": [
    "eventClass",
    "tenantId",
    "sourceEventId",
    "employerCnpj",
    "competence",
    "payrollRunId",
    "payrollRunStatus",
    "benefits"
  ],
  "not": {
    "anyOf": [
      {
        "required": [
          "xml"
        ]
      },
      {
        "required": [
          "payloadXml"
        ]
      },
      {
        "required": [
          "signedXml"
        ]
      },
      {
        "required": [
          "signedEnvelope"
        ]
      },
      {
        "required": [
          "pkcs7"
        ]
      },
      {
        "required": [
          "pkcs7Sha256"
        ]
      }
    ]
  }
}
